{
  "schemaVersion": "catverter.units/v1",
  "id": "catverter.gioztrex.test-pack-28",
  "displayName": "Diplomatic Onion Pack",
  "version": "1.0.41",
  "author": "gioztrex",
  "description": "Adds a single test mass unit for pack-list stress testing.",
  "units": [
    {
      "id": "diplomatic-onion",
      "dimension": "mass",
      "name": "Diplomatic onion",
      "symbol": "don",
      "emoji": "📦",
      "singularName": "diplomatic onion",
      "pluralName": "diplomatic onions",
      "description": "An onion that negotiates before making anyone cry.",
      "scientificNote": "Layers recognized as separate advisory boards.",
      "origin": "GiozTrex Template Stress Test",
      "baseFactor": 0.15,
      "tags": [
        "intuitive",
        "food"
      ],
      "families": [
        "food"
      ],
      "scientificAccuracy": "committeeConsensus"
    }
  ],
  "dependencies": [
    {
      "id": "catverter.core.mass",
      "minVersion": "1.0.0"
    }
  ]
}
