{
  "schemaVersion": "catverter.units/v1",
  "id": "catverter.gioztrex.test-pack-12",
  "displayName": "Ceremonial Remote Pack",
  "version": "1.0.1",
  "author": "gioztrex",
  "description": "Adds a single test mass unit for pack-list stress testing.",
  "units": [
    {
      "id": "ceremonial-remote-control",
      "dimension": "mass",
      "name": "Ceremonial remote control",
      "symbol": "crc",
      "emoji": "📦",
      "singularName": "ceremonial remote control",
      "pluralName": "ceremonial remote controls",
      "description": "A remote that controls only very formal televisions.",
      "scientificNote": "Battery mass included because somebody has to decide.",
      "origin": "GiozTrex Template Stress Test",
      "baseFactor": 0.16,
      "tags": [
        "intuitive",
        "household"
      ],
      "families": [
        "technology",
        "householdObject"
      ],
      "scientificAccuracy": "committeeConsensus"
    }
  ],
  "dependencies": [
    {
      "id": "catverter.core.mass",
      "minVersion": "1.0.0"
    }
  ]
}
