{
  "schemaVersion": "catverter.units/v1",
  "id": "catverter.gioztrex.test-pack-05",
  "displayName": "Heroic Lasagna Square Pack",
  "version": "1.0.0",
  "author": "gioztrex",
  "description": "Adds a single test mass unit for pack-list stress testing.",
  "units": [
    {
      "id": "heroic-lasagna-square",
      "dimension": "mass",
      "name": "Heroic lasagna square",
      "symbol": "hls",
      "emoji": "📦",
      "singularName": "heroic lasagna square",
      "pluralName": "heroic lasagna squares",
      "description": "A structural food unit with excellent morale.",
      "scientificNote": "Layers counted by optimism rather than microscopy.",
      "origin": "GiozTrex Template Stress Test",
      "baseFactor": 0.35,
      "tags": [
        "intuitive",
        "food"
      ],
      "families": [
        "food"
      ],
      "scientificAccuracy": "committeeConsensus"
    }
  ],
  "dependencies": [
    {
      "id": "catverter.core.mass",
      "minVersion": "1.0.0"
    }
  ]
}
