{
  "schemaVersion": "catverter.units/v1",
  "id": "catverter.gioztrex.test-pack-06",
  "displayName": "Tiny Anvil Pack",
  "version": "1.0.41",
  "author": "gioztrex",
  "description": "Adds a single test mass unit for pack-list stress testing.",
  "units": [
    {
      "id": "tiny-anvil",
      "dimension": "mass",
      "name": "Tiny anvil",
      "symbol": "ta",
      "emoji": "📦",
      "singularName": "tiny anvil",
      "pluralName": "tiny anvils",
      "description": "A surprisingly serious metal opinion.",
      "scientificNote": "Falls excluded from repeatability studies.",
      "origin": "GiozTrex Template Stress Test",
      "baseFactor": 1.2,
      "tags": [
        "intuitive",
        "household"
      ],
      "families": [
        "householdObject"
      ],
      "scientificAccuracy": "committeeConsensus"
    }
  ],
  "dependencies": [
    {
      "id": "catverter.core.mass",
      "minVersion": "1.0.0"
    }
  ]
}
