{
  "schemaVersion": "catverter.units/v1",
  "id": "catverter.gioztrex.test-pack-22",
  "displayName": "Victory Muffin Pack",
  "version": "1.0.0",
  "author": "gioztrex",
  "description": "Adds a single test mass unit for pack-list stress testing.",
  "units": [
    {
      "id": "victory-muffin",
      "dimension": "mass",
      "name": "Victory muffin",
      "symbol": "vmuf",
      "emoji": "📦",
      "singularName": "victory muffin",
      "pluralName": "victory muffins",
      "description": "A muffin awarded after a successful calibration.",
      "scientificNote": "Celebratory crumbs count as morale, not mass.",
      "origin": "GiozTrex Template Stress Test",
      "baseFactor": 0.09,
      "tags": [
        "intuitive",
        "food"
      ],
      "families": [
        "food"
      ],
      "scientificAccuracy": "committeeConsensus"
    }
  ],
  "dependencies": [
    {
      "id": "catverter.core.mass",
      "minVersion": "1.0.0"
    }
  ]
}
