{
  "schemaVersion": "catverter.units/v1",
  "id": "catverter.gioztrex.test-pack-23",
  "displayName": "Bureaucracy Stapler Pack",
  "version": "1.0.0",
  "author": "gioztrex",
  "description": "Adds a single test mass unit for pack-list stress testing.",
  "units": [
    {
      "id": "bureaucracy-stapler",
      "dimension": "mass",
      "name": "Bureaucracy stapler",
      "symbol": "bst",
      "emoji": "📦",
      "singularName": "bureaucracy stapler",
      "pluralName": "bureaucracy staplers",
      "description": "A stapler carrying the weight of paperwork itself.",
      "scientificNote": "Staple reserves included at average office capacity.",
      "origin": "GiozTrex Template Stress Test",
      "baseFactor": 0.21,
      "tags": [
        "intuitive",
        "household"
      ],
      "families": [
        "technology",
        "householdObject"
      ],
      "scientificAccuracy": "committeeConsensus"
    }
  ],
  "dependencies": [
    {
      "id": "catverter.core.mass",
      "minVersion": "1.0.0"
    }
  ]
}
