{
  "schemaVersion": "catverter.units/v1",
  "id": "catverter.gioztrex.test-pack-26",
  "displayName": "Solemn Pizza Slice Pack",
  "version": "1.0.0",
  "author": "gioztrex",
  "description": "Adds a single test mass unit for pack-list stress testing.",
  "units": [
    {
      "id": "solemn-pizza-slice",
      "dimension": "mass",
      "name": "Solemn pizza slice",
      "symbol": "sps",
      "emoji": "📦",
      "singularName": "solemn pizza slice",
      "pluralName": "solemn pizza slices",
      "description": "A pizza slice aware of its civic duty.",
      "scientificNote": "Cheese stretch excluded from linear dramatics.",
      "origin": "GiozTrex Template Stress Test",
      "baseFactor": 0.11,
      "tags": [
        "intuitive",
        "food"
      ],
      "families": [
        "food"
      ],
      "scientificAccuracy": "committeeConsensus"
    }
  ],
  "dependencies": [
    {
      "id": "catverter.core.mass",
      "minVersion": "1.0.0"
    }
  ]
}
