{
  "schemaVersion": "catverter.units/v1",
  "id": "catverter.gioztrex.test-pack-16",
  "displayName": "Legendary Sock Pack",
  "version": "1.0.1",
  "author": "gioztrex",
  "description": "Adds a single test mass unit for pack-list stress testing.",
  "units": [
    {
      "id": "legendary-sock",
      "dimension": "mass",
      "name": "Legendary sock",
      "symbol": "lsock",
      "emoji": "📦",
      "singularName": "legendary sock",
      "pluralName": "legendary socks",
      "description": "A sock that survived the laundry dimension.",
      "scientificNote": "Pairing probability not part of mass calibration.",
      "origin": "GiozTrex Template Stress Test",
      "baseFactor": 0.04,
      "tags": [
        "intuitive",
        "household"
      ],
      "families": [
        "householdObject"
      ],
      "scientificAccuracy": "committeeConsensus"
    }
  ],
  "dependencies": [
    {
      "id": "catverter.core.mass",
      "minVersion": "1.0.0"
    }
  ]
}
