{
  "schemaVersion": "catverter.units/v1",
  "id": "catverter.core.speed",
  "displayName": "Velocità Core Catverter",
  "version": "1.0.1",
  "author": "Catverter",
  "description": "Unità di velocità buffe costruite da lunghezze e tempi core.",
  "ratioUnits": [
    {
      "id": "cat-tail-per-tail-flick",
      "dimension": "speed",
      "numeratorUnitId": "cat-tail",
      "denominatorUnitId": "tail-flick",
      "emoji": "🐈",
      "description": "Una velocità di fuga felina compatta.",
      "scientificNote": "Valida quando la coda ha registrato lieve disapprovazione.",
      "origin": "Banco Standard del Moto Felino",
      "tags": [
        "cats",
        "intuitive"
      ],
      "name": "Coda di gatto per scatto di coda",
      "symbol": "code di gatto/scatto di coda",
      "singularName": "coda di gatto per scatto di coda",
      "pluralName": "code di gatto per scatto di coda",
      "grammar": {
        "gender": "feminine"
      }
    },
    {
      "id": "cat-jump-per-tail-flick",
      "dimension": "speed",
      "numeratorUnitId": "cat-jump",
      "denominatorUnitId": "tail-flick",
      "emoji": "⚡",
      "description": "La velocità ufficiale del movimento inspiegabile delle 3 di notte.",
      "scientificNote": "I ricercatori consigliano di non stare in corridoio.",
      "origin": "Osservatorio della Velocità Notturna",
      "tags": [
        "cats",
        "animals",
        "pseudoScientific"
      ],
      "name": "Salto di gatto per scatto di coda",
      "symbol": "salti di gatto/scatto di coda",
      "singularName": "salto di gatto per scatto di coda",
      "pluralName": "salti di gatto per scatto di coda",
      "grammar": {
        "gender": "masculine"
      }
    },
    {
      "id": "stretched-cat-per-snack-request",
      "dimension": "speed",
      "numeratorUnitId": "stretched-cat",
      "denominatorUnitId": "snack-request",
      "emoji": "🐈↔️",
      "description": "Moto tranquillo misurato da un comitato affamato.",
      "scientificNote": "Il soggetto può accelerare sentendo aprire una scatoletta.",
      "origin": "Dipartimento Acquisizione Snack",
      "tags": [
        "cats",
        "food"
      ],
      "name": "Gatto stiracchiato per richiesta di snack",
      "symbol": "gatti stiracchiati/richiesta di snack",
      "singularName": "gatto stiracchiato per richiesta di snack",
      "pluralName": "gatti stiracchiati per richiesta di snack",
      "grammar": {
        "gender": "masculine"
      }
    },
    {
      "id": "banana-per-microwave-second",
      "dimension": "speed",
      "numeratorUnitId": "banana",
      "denominatorUnitId": "microwave-second",
      "emoji": "🍌",
      "description": "Velocità da cucina per oggetti leggermente impazienti.",
      "scientificNote": "I secondi da microonde restano emotivamente più lunghi dei secondi SI.",
      "origin": "Istituto del Tempo in Cucina",
      "tags": [
        "food",
        "intuitive"
      ],
      "name": "Banana per secondo da microonde",
      "symbol": "banane/secondo da microonde",
      "singularName": "banana per secondo da microonde",
      "pluralName": "banane per secondo da microonde",
      "grammar": {
        "gender": "feminine"
      }
    },
    {
      "id": "sofa-per-developer-hour",
      "dimension": "speed",
      "numeratorUnitId": "sofa",
      "denominatorUnitId": "developer-hour",
      "emoji": "🛋️",
      "description": "Progresso dopo che un piccolo refactoring diventa filosofia architetturale.",
      "scientificNote": "La velocità diminuisce mentre si dà il nome alle cose.",
      "origin": "Istituto di Cronometria Software",
      "tags": [
        "geek",
        "household"
      ],
      "name": "Divano per ora sviluppatore",
      "symbol": "divani/ora sviluppatore",
      "singularName": "divano per ora sviluppatore",
      "pluralName": "divani per ora sviluppatore",
      "grammar": {
        "gender": "masculine"
      }
    },
    {
      "id": "city-bus-per-quick-meeting",
      "dimension": "speed",
      "numeratorUnitId": "city-bus",
      "denominatorUnitId": "quick-meeting",
      "emoji": "🚌",
      "description": "Una velocità da trasporto pubblico per sofferenze basate sul calendario.",
      "scientificNote": "La durata della riunione si estende sotto pressione dell'ordine del giorno.",
      "origin": "Comitato Standard Ufficio",
      "tags": [
        "intuitive",
        "household"
      ],
      "name": "Autobus urbano per riunione veloce",
      "symbol": "autobus urbani/riunione veloce",
      "singularName": "autobus urbano per riunione veloce",
      "pluralName": "autobus urbani per riunione veloce",
      "grammar": {
        "gender": "masculine"
      }
    },
    {
      "id": "football-field-per-pizza-delivery",
      "dimension": "speed",
      "numeratorUnitId": "football-field",
      "denominatorUnitId": "pizza-delivery",
      "emoji": "🏈",
      "description": "Distanza da redazione divisa per latenza da fame.",
      "scientificNote": "La vicinanza della pizza può causare distorsioni di velocità percepita.",
      "origin": "Autorità Logistica Pizza",
      "tags": [
        "food",
        "intuitive"
      ],
      "name": "Campo da football per consegna pizza",
      "symbol": "campi da football/consegna pizza",
      "singularName": "campo da football per consegna pizza",
      "pluralName": "campi da football per consegna pizza",
      "grammar": {
        "gender": "masculine"
      }
    },
    {
      "id": "giraffe-per-snooze",
      "dimension": "speed",
      "numeratorUnitId": "giraffe",
      "denominatorUnitId": "snooze",
      "emoji": "🦒",
      "description": "Una misura alta e assonnata del progresso graduale.",
      "scientificNote": "La lunghezza del collo viene revisionata separatamente dal comitato.",
      "origin": "Divisione Ricerca sul Sonno",
      "tags": [
        "animals"
      ],
      "name": "Giraffa per snooze",
      "symbol": "giraffe/snooze",
      "singularName": "giraffa per snooze",
      "pluralName": "giraffe per snooze",
      "grammar": {
        "gender": "feminine"
      }
    },
    {
      "id": "spaghetti-per-happy-cat-wink",
      "dimension": "speed",
      "numeratorUnitId": "spaghetti",
      "denominatorUnitId": "happy-cat-wink",
      "emoji": "🍝",
      "description": "Una velocità di pasta tenera con sfumature emotive.",
      "scientificNote": "Le osservazioni scotte sono respinte dai revisori italiani.",
      "origin": "Consiglio Italiano Standard Pasta",
      "tags": [
        "food",
        "cats"
      ],
      "name": "Spaghetto per occhiolino di gatto felice",
      "symbol": "spaghetti/occhiolino di gatto felice",
      "singularName": "spaghetto per occhiolino di gatto felice",
      "pluralName": "spaghetti per occhiolino di gatto felice",
      "grammar": {
        "gender": "masculine"
      }
    },
    {
      "id": "blue-whale-length-per-monday-morning",
      "dimension": "speed",
      "numeratorUnitId": "blue-whale-length",
      "denominatorUnitId": "monday-morning",
      "emoji": "🐋",
      "description": "Un grande movimento distribuito sul più lungo fenomeno d'ufficio conosciuto.",
      "scientificNote": "Dilatazione temporale confermata dagli studi sul posto di lavoro.",
      "origin": "Dipartimento della Sofferenza Settimanale",
      "tags": [
        "animals",
        "hugeThings"
      ],
      "name": "Balena azzurra per lunedì mattina",
      "symbol": "balene azzurre/lunedì mattina",
      "singularName": "balena azzurra per lunedì mattina",
      "pluralName": "balene azzurre per lunedì mattina",
      "grammar": {
        "gender": "feminine"
      }
    },
    {
      "id": "t-rex-per-one-more-turn",
      "dimension": "speed",
      "numeratorUnitId": "t-rex",
      "denominatorUnitId": "one-more-turn",
      "emoji": "🦖",
      "description": "Progresso preistorico durante la negazione strategica dell'ora di dormire.",
      "scientificNote": "Le braccia non influenzano i calcoli aerodinamici.",
      "origin": "Laboratorio di Distorsione Temporale Interattiva",
      "tags": [
        "geek",
        "animals"
      ],
      "name": "T-Rex per un altro turno",
      "symbol": "T-Rex/altri turni",
      "singularName": "T-Rex per un altro turno",
      "pluralName": "T-Rex per altri turni",
      "grammar": {
        "gender": "masculine"
      }
    },
    {
      "id": "ikea-instruction-per-loading-bar-minute",
      "dimension": "speed",
      "numeratorUnitId": "ikea-instruction",
      "denominatorUnitId": "loading-bar-minute",
      "emoji": "📖",
      "description": "Documentazione di montaggio che si muove alla velocità di un aggiornamento software.",
      "scientificNote": "Le viti mancanti possono ridurre la fiducia ma non la velocità nominale.",
      "origin": "Autorità Nordica di Montaggio",
      "tags": [
        "household",
        "geek"
      ],
      "name": "Istruzione IKEA per minuto barra di caricamento",
      "symbol": "istruzioni IKEA/minuto barra di caricamento",
      "singularName": "istruzione IKEA per minuto barra di caricamento",
      "pluralName": "istruzioni IKEA per minuto barra di caricamento",
      "grammar": {
        "gender": "feminine"
      }
    }
  ],
  "kind": "units"
}
