{
  "schemaVersion": "catverter.units/v1",
  "id": "catverter.gioztrex.test-pack-03",
  "displayName": "Office Biscuit Pack",
  "version": "1.0.0",
  "author": "gioztrex",
  "description": "Adds a single test mass unit for pack-list stress testing.",
  "units": [
    {
      "id": "office-biscuit",
      "dimension": "mass",
      "name": "Office biscuit",
      "symbol": "ob",
      "emoji": "📦",
      "singularName": "office biscuit",
      "pluralName": "office biscuits",
      "description": "A biscuit that has attended too many meetings.",
      "scientificNote": "Crumbs counted only when politically convenient.",
      "origin": "GiozTrex Template Stress Test",
      "baseFactor": 0.012,
      "tags": [
        "intuitive",
        "food"
      ],
      "families": [
        "food",
        "technology"
      ],
      "scientificAccuracy": "committeeConsensus"
    }
  ],
  "dependencies": [
    {
      "id": "catverter.core.mass",
      "minVersion": "1.0.0"
    }
  ]
}
