{
  "schemaVersion": "catverter.units/v1",
  "id": "catverter.gioztrex.test-pack-24",
  "displayName": "Micro Fridge Magnet Pack",
  "version": "1.0.0",
  "author": "gioztrex",
  "description": "Adds a single test mass unit for pack-list stress testing.",
  "units": [
    {
      "id": "micro-fridge-magnet",
      "dimension": "mass",
      "name": "Micro fridge magnet",
      "symbol": "mfm",
      "emoji": "📦",
      "singularName": "micro fridge magnet",
      "pluralName": "micro fridge magnets",
      "description": "A tiny authority holding one note against gravity.",
      "scientificNote": "Magnetism admired but not weighed separately.",
      "origin": "GiozTrex Template Stress Test",
      "baseFactor": 0.015,
      "tags": [
        "intuitive",
        "food",
        "household"
      ],
      "families": [
        "householdObject"
      ],
      "scientificAccuracy": "committeeConsensus"
    }
  ],
  "dependencies": [
    {
      "id": "catverter.core.mass",
      "minVersion": "1.0.0"
    }
  ]
}
