{
  "schemaVersion": "catverter.units/v1",
  "id": "catverter.gioztrex.test-pack-20",
  "displayName": "Parliament Banana Pack",
  "version": "1.0.0",
  "author": "gioztrex",
  "description": "Adds a single test mass unit for pack-list stress testing.",
  "units": [
    {
      "id": "parliament-banana",
      "dimension": "mass",
      "name": "Parliament banana",
      "symbol": "pban",
      "emoji": "📦",
      "singularName": "parliament banana",
      "pluralName": "parliament bananas",
      "description": "A banana passed by a narrow majority.",
      "scientificNote": "Curvature debates tabled indefinitely.",
      "origin": "GiozTrex Template Stress Test",
      "baseFactor": 0.12,
      "tags": [
        "intuitive",
        "food"
      ],
      "families": [
        "food"
      ],
      "scientificAccuracy": "committeeConsensus"
    }
  ],
  "dependencies": [
    {
      "id": "catverter.core.mass",
      "minVersion": "1.0.0"
    }
  ]
}
