{
  "schemaVersion": "catverter.units/v1",
  "id": "catverter.gioztrex.test-pack-01",
  "displayName": "Ceremonial Spoon Pack",
  "version": "1.0.0",
  "author": "gioztrex",
  "description": "Adds a single test mass unit for pack-list stress testing.",
  "units": [
    {
      "id": "ceremonial-spoon",
      "dimension": "mass",
      "name": "Ceremonial spoon",
      "symbol": "csp",
      "emoji": "📦",
      "singularName": "ceremonial spoon",
      "pluralName": "ceremonial spoons",
      "description": "A spoon promoted far beyond its natural authority.",
      "scientificNote": "Mass includes ceremonial expectations but excludes soup.",
      "origin": "GiozTrex Template Stress Test",
      "baseFactor": 0.018,
      "tags": [
        "intuitive",
        "food",
        "household"
      ],
      "families": [
        "householdObject"
      ],
      "scientificAccuracy": "committeeConsensus"
    }
  ],
  "dependencies": [
    {
      "id": "catverter.core.mass",
      "minVersion": "1.0.0"
    }
  ]
}
