{
  "schemaVersion": "catverter.units/v1",
  "id": "catverter.gioztrex.test-pack-15",
  "displayName": "Sofa Crumb Pack",
  "version": "1.0.0",
  "author": "gioztrex",
  "description": "Adds a single test mass unit for pack-list stress testing.",
  "units": [
    {
      "id": "sofa-crumb",
      "dimension": "mass",
      "name": "Sofa crumb",
      "symbol": "scr",
      "emoji": "📦",
      "singularName": "sofa crumb",
      "pluralName": "sofa crumbs",
      "description": "A tiny relic recovered from domestic archaeology.",
      "scientificNote": "Age unknown, emotional weight significant.",
      "origin": "GiozTrex Template Stress Test",
      "baseFactor": 0.002,
      "tags": [
        "intuitive",
        "tinyThings"
      ],
      "families": [
        "householdObject"
      ],
      "scientificAccuracy": "committeeConsensus"
    }
  ],
  "dependencies": [
    {
      "id": "catverter.core.mass",
      "minVersion": "1.0.0"
    }
  ]
}
