{
  "schemaVersion": "catverter.units/v1",
  "id": "catverter.gioztrex.test-pack-21",
  "displayName": "Confused Teacup Pack",
  "version": "1.0.41",
  "author": "gioztrex",
  "description": "Adds a single test mass unit for pack-list stress testing.",
  "units": [
    {
      "id": "confused-teacup",
      "dimension": "mass",
      "name": "Confused teacup",
      "symbol": "ctc",
      "emoji": "📦",
      "singularName": "confused teacup",
      "pluralName": "confused teacups",
      "description": "A teacup unsure whether it is decorative or responsible.",
      "scientificNote": "Tea not included unless specified by ceremony.",
      "origin": "GiozTrex Template Stress Test",
      "baseFactor": 0.2,
      "tags": [
        "intuitive",
        "food",
        "household"
      ],
      "families": [
        "householdObject"
      ],
      "scientificAccuracy": "committeeConsensus"
    }
  ],
  "dependencies": [
    {
      "id": "catverter.core.mass",
      "minVersion": "1.0.0"
    }
  ]
}
